{
  "schemaStamp": "2020-04-15T21:09:52.745905",
  "instrumentName": "BIOSANS",
  "iptsNumber": "23782",
  "dataDirectories": null,
  "sample": {
    "runNumber": "4822",
    "thickness": "0.1",
    "transmission": {
      "runNumber": "4822",
      "value": ""
    }
  },
  "background": {
    "runNumber": "4821",
    "transmission": {
      "runNumber": "4821",
      "value": ""
    }
  },
  "emptyTransmission": {
    "runNumber": "4820",
    "value": null
  },
  "beamCenter": {
    "runNumber": "4819"
  },
  "outputFileName": "CG3_4822_wedge",
  "configuration": {
    "outputDir": "/tmp/CG3_4822_wedge",
    "wavelength": "",
    "wavelengthSpread": "",
    "useTimeSlice": false,
    "useTimeSliceTransmission": false,
    "timeSliceInterval": "",
    "useLogSlice": false,
    "logSliceName": "",
    "logSliceInterval": "",
    "sampleOffset": "",
    "sampleApertureSize": "12",
    "sampleDetectorDistance": null,
    "sampleToSi": null,
    "sourceApertureDiameter": "",
    "usePixelCalibration": false,
    "maskFileName": "",
    "useDefaultMask": true,
    "defaultMask": [
      "{'Pixel':'1-18,239-256'}",
      "{'Bank':'18-24,42-48'}"
    ],
    "useMaskBackTubes": false,
    "darkMainFileName": "/HFIR/CG3/shared/Cycle486/CG3_5187.nxs.h5",
    "darkWingFileName": "/HFIR/CG3/shared/Cycle486/CG3_5187.nxs.h5",
    "darkMidrangeFileName": "/HFIR/CG3/shared/Cycle486/CG3_5187.nxs.h5",
    "normalizationResortToTime": false,
    "normalization": "Monitor",
    "sensitivityMainFileName": "/HFIR/CG3/shared/Cycle486/Old_Sens/sens_f4829m7p0_TDC_SAC.h5",
    "sensitivityWingFileName": "/HFIR/CG3/shared/Cycle486/Old_Sens/sens_f4843w1p4_TDC_SAC.h5",
    "sensitivityMidrangeFileName": "/HFIR/CG3/shared/Cycle486/Old_Sens/sens_f4843w1p4_TDC_SAC.h5",
    "useSolidAngleCorrection": true,
    "blockedBeamRunNumber": "",
    "useThetaDepTransCorrection": true,
    "DBScalingBeamRadius": "",
    "mmRadiusForTransmission": "",
    "absoluteScaleMethod": "standard",
    "StandardAbsoluteScale": "2e-8",
    "numMainQxQyBins": 150,
    "numWingQxQyBins": 150,
    "numMidrangeQxQyBins": 150,
    "1DQbinType": "wedge",
    "QbinType": "log",
    "numMainQBins": 33,
    "numWingQBins": 33,
    "numMidrangeQBins": 33,
    "LogQBinsPerDecadeMain": null,
    "LogQBinsPerDecadeWing": null,
    "LogQBinsPerDecadeMidrange": null,
    "useLogQBinsDecadeCenter": false,
    "useLogQBinsEvenDecade": false,
    "WedgeMinAngles": [
      -30,
      60
    ],
    "WedgeMaxAngles": [
      30,
      120
    ],
    "autoWedgeQmin": 0.003,
    "autoWedgeQmax": 0.04,
    "autoWedgeQdelta": 0.01,
    "autoWedgeAzimuthalDelta": 1,
    "autoWedgePeakWidth": 0.25,
    "autoWedgeBackgroundWidth": 1.5,
    "autoWedgeSignalToNoiseMin": 2,
    "AnnularAngleBin": "1",
    "useErrorWeighting": true,
    "smearingPixelSizeX": null,
    "smearingPixelSizeY": null,
    "useSubpixels": false,
    "subpixelsX": null,
    "subpixelsY": null,
    "QminMain": "",
    "QmaxMain": "",
    "QminWing": "",
    "QmaxWing": "",
    "QminMidrange": "",
    "QmaxMidrange": "",
    "overlapStitchQmin":  0.031,
    "overlapStitchQmax":  0.0375,
    "wedge1QminMain": 0.02,
    "wedge1QmaxMain": 0.09,
    "wedge1QminWing": 0.08,
    "wedge1QmaxWing": 0.09,
    "wedge1QminMidrange" : 0.04,
    "wedge1QmaxMidrange" : 0.05,
    "wedge1overlapStitchQmin": 0.0825,
    "wedge1overlapStitchQmax": 0.0875,
    "wedge2QminMain": 0.02,
    "wedge2QmaxMain": 0.125,
    "wedge2QminWing": 0.06,
    "wedge2QmaxWing": 1,
    "wedge2QminMidrange": 0.05,
    "wedge2QmaxMidrange": 0.7,
    "wedge2overlapStitchQmin": 0.075,
    "wedge2overlapStitchQmax": 0.095,
    "overlapStitchIncludeMidrange": false
  }
}
